{
  "schemaVersion": 2,
  "campaignId": "campaign.vertical_slice.first_hour",
  "fingerprint": "2c82c47966c118441564e717007e451326bfdea4",
  "quests": [
    {
      "id": "quest.wake_the_hall", "title": "Wake the Hall", "sourceDefinitionId": "quest.wake_the_hall.v2", "assetPath": "/Game/DA/Quests/Q_WakeTheHall",
      "prerequisiteQuestIds": [], "startCondition": "NewCampaign",
      "worldAssetBindings": [
        {"bindingId": "founder_hall", "definitionId": "special.founder_hall", "bindWhen": "Start", "cityId": "player_capital", "ownerId": "civilization.synara", "requireOperational": false}
      ],
      "nodes": [
        {"id": "start", "type": "Start", "sourceDefinitionId": "quest.wake_the_hall.start", "condition": "NewCampaign", "edges": [{"branchTag": "begin", "targetNodeId": "reach_hall"}]},
        {"id": "reach_hall", "type": "Objective", "sourceDefinitionId": "quest.wake_the_hall.reach", "condition": "FounderReached", "bindingId": "founder_hall", "edges": [{"branchTag": "reached", "targetNodeId": "restore_power"}]},
        {"id": "restore_power", "type": "Objective", "sourceDefinitionId": "quest.wake_the_hall.power", "condition": "FounderHallPowered", "bindingId": "founder_hall", "edges": [{"branchTag": "powered", "targetNodeId": "route_choice"}]},
        {"id": "route_choice", "type": "Choice", "sourceDefinitionId": "quest.wake_the_hall.route", "condition": "ExplicitChoice", "edges": [{"branchTag": "explore_markings", "targetNodeId": "inspect_markings"}, {"branchTag": "continue_activation", "targetNodeId": "activate_core"}]},
        {"id": "inspect_markings", "type": "Explore", "sourceDefinitionId": "quest.wake_the_hall.markings", "condition": "CustodianMarkingsInspected", "edges": [{"branchTag": "observed", "targetNodeId": "activate_core"}]},
        {"id": "activate_core", "type": "Objective", "sourceDefinitionId": "quest.wake_the_hall.activate", "condition": "FounderHallOnline", "bindingId": "founder_hall", "edges": [{"branchTag": "online", "targetNodeId": "resolution"}]},
        {"id": "resolution", "type": "Resolution", "sourceDefinitionId": "quest.wake_the_hall.resolution", "condition": "Resolved", "edges": []}
      ],
      "completionHistoryTags": ["founder_hall_awake"],
      "rewards": [
        {"actionId": "reward.wake_the_hall.city_mode", "type": "CityMode", "contentId": "mode.city", "quantity": 1},
        {"actionId": "reward.wake_the_hall.adaptive_habitat", "type": "CardInstance", "definitionId": "synara.adaptive_habitat", "quantity": 1}
      ],
      "outcomes": {}
    },
    {
      "id": "quest.a_place_to_stay", "title": "A Place to Stay", "sourceDefinitionId": "quest.a_place_to_stay.v2", "assetPath": "/Game/DA/Quests/Q_APlaceToStay",
      "prerequisiteQuestIds": ["quest.wake_the_hall"], "startCondition": "PrerequisitesMet",
      "worldAssetBindings": [
        {"bindingId": "adaptive_habitat", "definitionId": "synara.adaptive_habitat", "bindWhen": "Objective", "cityId": "player_capital", "ownerId": "civilization.synara", "requireOperational": false}
      ],
      "nodes": [
        {"id": "start", "type": "Start", "sourceDefinitionId": "quest.a_place_to_stay.start", "condition": "PrerequisitesMet", "edges": [{"branchTag": "begin", "targetNodeId": "inspect_card"}]},
        {"id": "inspect_card", "type": "Objective", "sourceDefinitionId": "quest.a_place_to_stay.inspect", "condition": "AdaptiveHabitatInspected", "edges": [{"branchTag": "inspected", "targetNodeId": "place_habitat"}]},
        {"id": "place_habitat", "type": "Build", "sourceDefinitionId": "quest.a_place_to_stay.place", "condition": "AdaptiveHabitatPlaced", "bindingId": "adaptive_habitat", "edges": [{"branchTag": "placed", "targetNodeId": "habitat_operational"}]},
        {"id": "habitat_operational", "type": "Build", "sourceDefinitionId": "quest.a_place_to_stay.operational", "condition": "HabitatConstructionComplete", "bindingId": "adaptive_habitat", "edges": [{"branchTag": "built", "targetNodeId": "citizens_arrive"}]},
        {"id": "citizens_arrive", "type": "CitizenCondition", "sourceDefinitionId": "quest.a_place_to_stay.arrival", "condition": "NiaPresent", "edges": [{"branchTag": "arrived", "targetNodeId": "resolution"}]},
        {"id": "resolution", "type": "Resolution", "sourceDefinitionId": "quest.a_place_to_stay.resolution", "condition": "Resolved", "edges": []}
      ],
      "completionHistoryTags": [],
      "rewards": [
        {"actionId": "reward.a_place_to_stay.microgrid_blueprint", "type": "Blueprint", "definitionId": "universal.microgrid_station", "quantity": 1},
        {"actionId": "reward.a_place_to_stay.water_blueprint", "type": "Blueprint", "definitionId": "universal.water_reclaimer", "quantity": 1}
      ],
      "outcomes": {}
    },
    {
      "id": "quest.power_water_people", "title": "Power, Water, People", "sourceDefinitionId": "quest.power_water_people.v2", "assetPath": "/Game/DA/Quests/Q_PowerWaterPeople",
      "prerequisiteQuestIds": ["quest.a_place_to_stay"], "startCondition": "HabitatOccupied",
      "worldAssetBindings": [
        {"bindingId": "adaptive_habitat", "definitionId": "synara.adaptive_habitat", "bindWhen": "Start", "cityId": "player_capital", "ownerId": "civilization.synara", "requireOperational": true},
        {"bindingId": "microgrid_station", "definitionId": "universal.microgrid_station", "bindWhen": "Objective", "cityId": "player_capital", "ownerId": "civilization.synara", "requireOperational": true},
        {"bindingId": "water_reclaimer", "definitionId": "universal.water_reclaimer", "bindWhen": "Objective", "cityId": "player_capital", "ownerId": "civilization.synara", "requireOperational": true}
      ],
      "nodes": [
        {"id": "start", "type": "Start", "sourceDefinitionId": "quest.power_water_people.start", "condition": "HabitatOccupied", "bindingId": "adaptive_habitat", "edges": [{"branchTag": "begin", "targetNodeId": "microgrid_operational"}]},
        {"id": "microgrid_operational", "type": "Build", "sourceDefinitionId": "quest.power_water_people.microgrid", "condition": "BoundAssetOperational", "bindingId": "microgrid_station", "edges": [{"branchTag": "power_asset", "targetNodeId": "water_operational"}]},
        {"id": "water_operational", "type": "Build", "sourceDefinitionId": "quest.power_water_people.water", "condition": "BoundAssetOperational", "bindingId": "water_reclaimer", "edges": [{"branchTag": "water_asset", "targetNodeId": "coverage_choice"}]},
        {"id": "coverage_choice", "type": "Choice", "sourceDefinitionId": "quest.power_water_people.coverage", "condition": "ExplicitChoice", "edges": [{"branchTag": "within_coverage", "targetNodeId": "power_supplied"}, {"branchTag": "expand_network", "targetNodeId": "expansion_guidance"}]},
        {"id": "expansion_guidance", "type": "Objective", "sourceDefinitionId": "quest.power_water_people.expansion", "condition": "UtilityExpansionAcknowledged", "edges": [{"branchTag": "expanded", "targetNodeId": "power_supplied"}]},
        {"id": "power_supplied", "type": "WorldCondition", "sourceDefinitionId": "quest.power_water_people.power_supply", "condition": "HabitatPowerFullySupplied", "bindingId": "adaptive_habitat", "edges": [{"branchTag": "powered", "targetNodeId": "water_supplied"}]},
        {"id": "water_supplied", "type": "WorldCondition", "sourceDefinitionId": "quest.power_water_people.water_supply", "condition": "HabitatWaterFullySupplied", "bindingId": "adaptive_habitat", "edges": [{"branchTag": "supplied", "targetNodeId": "resolution"}]},
        {"id": "resolution", "type": "Resolution", "sourceDefinitionId": "quest.power_water_people.resolution", "condition": "Resolved", "edges": []}
      ],
      "completionHistoryTags": [],
      "rewards": [{"actionId": "reward.power_water_people.utility_systems", "type": "UtilitySystems", "contentId": "system.utilities", "quantity": 1}],
      "outcomes": {}
    },
    {
      "id": "quest.nia_needs_a_job", "title": "Nia Needs a Job", "sourceDefinitionId": "quest.nia_needs_a_job.v2", "assetPath": "/Game/DA/Quests/Q_NiaNeedsAJob",
      "prerequisiteQuestIds": ["quest.power_water_people"], "startCondition": "PrerequisitesMet",
      "worldAssetBindings": [
        {"bindingId": "cognitive_operations_tower", "definitionId": "synara.cognitive_operations_tower", "bindWhen": "Objective", "cityId": "player_capital", "ownerId": "civilization.synara", "requireOperational": true}
      ],
      "nodes": [
        {"id": "start", "type": "Start", "sourceDefinitionId": "quest.nia_needs_a_job.start", "condition": "PrerequisitesMet", "edges": [{"branchTag": "begin", "targetNodeId": "speak_nia"}]},
        {"id": "speak_nia", "type": "Dialogue", "sourceDefinitionId": "quest.nia_needs_a_job.speak", "condition": "NiaSpokenTo", "edges": [{"branchTag": "spoken", "targetNodeId": "tower_operational"}]},
        {"id": "tower_operational", "type": "Build", "sourceDefinitionId": "quest.nia_needs_a_job.tower", "condition": "BoundAssetOperational", "bindingId": "cognitive_operations_tower", "edges": [{"branchTag": "built", "targetNodeId": "half_staffed"}]},
        {"id": "half_staffed", "type": "CitizenCondition", "sourceDefinitionId": "quest.nia_needs_a_job.staff", "condition": "TowerHalfStaffed", "bindingId": "cognitive_operations_tower", "edges": [{"branchTag": "staffed", "targetNodeId": "nia_assigned"}]},
        {"id": "nia_assigned", "type": "CitizenCondition", "sourceDefinitionId": "quest.nia_needs_a_job.assigned", "condition": "NiaAssignedToTower", "bindingId": "cognitive_operations_tower", "edges": [{"branchTag": "employed", "targetNodeId": "resolution"}]},
        {"id": "resolution", "type": "Resolution", "sourceDefinitionId": "quest.nia_needs_a_job.resolution", "condition": "Resolved", "edges": []}
      ],
      "completionHistoryTags": [],
      "rewards": [
        {"actionId": "reward.nia_needs_a_job.operator_xp", "type": "OperatorXp", "contentId": "citizen.synara.nia_vale", "quantity": 1},